{
  "contract_id": "lnsat.daemon.config.v1",
  "contract_version": "lnsat.contracts.v1_0",
  "schema_version": 1,
  "database_path": "/tmp/lnsat-phase10/configured.sqlite3",
  "listen_address": "127.0.0.1:7447",
  "control_socket_path": "/tmp/lnsat-phase10/control/lnsatd.sock",
  "phase8_runtime": {
    "disposable_git_root": "/tmp/lnsat-phase10/disposable-git",
    "git_executable": "/usr/bin/git"
  },
  "console": {
    "root": "/tmp/lnsat-phase10/console",
    "asset_manifest": {
      "/": "index.html",
      "/assets/app.js": "assets/app.js"
    }
  }
}
